{"advancedFeaturesRequireEvidence":["child-contract-factories","return-delta-custom-accounting","custom-curves-and-async-swaps","liquidity-removal-gating-or-return-deltas","external-oracle-or-protocol-calls","pause-mint-transfer-or-compliance-controls","governed-upgrades-or-delegation","nonstandard-token-accounting"],"authority":{"admissionDisclosurePath":"policy/custom-launch-admission-v3.json","agentAdmissionAuthority":false,"businessPolicyPath":"policy/launch-policy.v1.json","businessPolicyScope":"programmable-router-fee-and-promotion-obligations","cliAdmissionAuthority":false,"clientAdmissionAuthority":false,"executableEvidenceAuthority":"private-custom-launch-api","platformAdmissionReceiptRequired":true},"behaviorAssurance":{"advancedRequiredVectorIds":["custom-accounting.delta-solvency","custom-accounting.inventory-backing","custom-accounting.refund","custom-accounting.withdrawal"],"authorizationScope":"exact-launch-provenance-only","missingRunnerEvidenceAuthority":"none","missingRunnerResult":"not_verified","mutableSurfaceResult":"conditional","riskClassifierVersion":"1.1.0","safetyResult":"not_verified","standardRequiredVectorIds":["swap.zero-for-one.exact-input.multi-size","swap.zero-for-one.exact-output.multi-size","swap.one-for-zero.exact-input.multi-size","swap.one-for-zero.exact-output.multi-size","swap.second-user","swap.time-advance","liquidity.lifecycle.add-remove-withdraw","callback.permission-mask-and-declaration","callback.enabled-entrypoints-and-selectors","callback.canonical-pool-manager-only","callback.unauthorized-rejected","callback.wrong-pool-rejected-or-isolated","fee.programmable-ten-bps","fee.no-bypass","fee.no-overcharge","fee.claim-isolation"],"vectorSetVersion":"1.1.0"},"claims":{"auditClaim":false,"feeBehaviorClaim":false,"safetyClaim":false,"universalCompatibilityClaim":false},"descriptorVersion":"1.0.0","feePolicyProjection":{"businessPolicyRuleId":"LAUNCH.ETHEREUM_AND_TREASURY_10_BPS","buybackManagementLive":false,"denominator":"1000000","feeBehaviorClaim":false,"genericClaimingLive":false,"programmableHundredthsOfBip":"1000","runtimeBehaviorClaim":"not-established-by-admission"},"hardSafetyInvariants":["exact-source-runtime-request-binding","hook-address-permission-mask-match","valid-return-delta-permission-dependencies","exact-mainnet-pool-manager","authenticated-enabled-callbacks","complete-enabled-callback-implementation","no-callcode-or-selfdestruct","balanced-pool-manager-deltas-when-executed","exact-router-launch-simulation","no-wallet-signing-or-broadcast-by-api"],"profile":{"chainId":"1","profileId":"programmable.direct-native-hook-graph.v1","profileRevision":3,"profileVersion":"3.2.0"},"schemaVersion":"programmable.custom-launch-admission-descriptor.v3","staticAdmission":{"hardBlockFindingRules":[{"code":"RUNTIME_CALLCODE","targetRoles":["any"]},{"code":"RUNTIME_SELFDESTRUCT","targetRoles":["any"]},{"code":"SOURCE_SELFDESTRUCT_SURFACE","targetRoles":["any"]},{"code":"V4_CALLBACK_AUTHENTICATION_MISSING","targetRoles":["hook"]},{"code":"V4_CALLBACK_AUTHENTICATION_INVALID","targetRoles":["hook"]},{"code":"V4_CALLBACK_POOL_MANAGER_MISMATCH","targetRoles":["hook"]},{"code":"V4_ENABLED_CALLBACK_IMPLEMENTATION_MISSING","targetRoles":["hook"]}],"manualProjectAllowlist":false,"needsEvidenceFindingCodes":["RUNTIME_CREATE","RUNTIME_CREATE2","SOURCE_TARGET_ANALYSIS_INCOMPLETE","V4_CALLBACK_AUTHENTICATION_REVIEW_REQUIRED","RUNTIME_DELEGATECALL","SOURCE_PROXY_OR_UPGRADE_SURFACE","SOURCE_MUTABLE_PAUSE_SURFACE","SOURCE_MUTABLE_BLOCKLIST_SURFACE","SOURCE_MUTABLE_TAX_OR_FEE_SURFACE","SOURCE_MUTABLE_TRANSFER_RESTRICTION","SOURCE_MUTABLE_ADMIN_SURFACE","SOURCE_PUBLIC_MINT_SURFACE","SOURCE_EXTERNAL_DEPENDENCY_SURFACE","SOURCE_TRANSFER_FEE_SURFACE","SOURCE_LIQUIDITY_LOCK_OR_CUSTODY_SURFACE"],"routerSimulationRequiredBeforeAuthorization":true,"unknownFindingDisposition":"needs-evidence"},"transport":{"capabilitiesUrl":"https://api.programmable.market/v3/capabilities","createPath":"/v3/custom-launches","discoveryUrl":"https://programmable.market/.well-known/programmable.json","openApiUrl":"https://programmable.market/openapi/custom-launch-v3.json","preflightPath":"/v3/custom-launches/preflight"}}
